Image; Model; Series; Yen Price; Release Date; Notes;Type
HGUC Gundam FIGHTERS Ver..jpg;RX-78-2 Gundam FIGHTERS Ver.;Mobile Suit Gundam;¥2,778;2019 April;Hokkaido Nippon-Ham Fighters exclusive color variant of HGUC-191,  bundled with specific match tickets and available through the team's official online store. Limited to 3000 units. Released as part of the Gundam 40th anniversary celebration.;HGUC
HGUC Zeta Gundam FIGHTERS Ver.jpg;MSZ-006 Zeta Gundam FIGHTERS Ver.;Mobile Suit Gundam;¥3,704;2019 July;Hokkaido Nippon-Ham Fighters exclusive color variant of HGUC-203,  bundled with specific match tickets. Limited to 1500 units. Released as part of the Gundam 40th anniversary celebration.;HGUC
HGUC Gundam EAGLES Ver.jpg;RX-78-2 Gundam EAGLES Ver.;Mobile Suit Gundam;N/A;2019 April;Tohoku Rakuten Golden Eagles exclusive color variant of HGUC-191,  bundled with specific match tickets. Limited to 3000 units. Released as part of the Gundam 40th anniversary celebration.;HGUC
HGUC Gundam Dragons Ver.jpg;RX-78-2 Gundam Dragons Ver.;Mobile Suit Gundam;N/A;2019 May;Chunichi Dragons (Nagoya) exclusive color variant of HGUC-191,  bundled with specific match tickets. Limited to 3000 units. Released as part of the Gundam 40th anniversary celebration.;HGUC
HGUC Gundam Tigers Ver.jpg;RX-78-2 Gundam Tigers Ver.;Mobile Suit Gundam;N/A;2019 May;Hanshin Tigers (Nishinomiya, Hyogo) exclusive color variant of HGUC-191,  bundled with specific match tickets. Limited to 3000 units. Released as part of the Gundam 40th anniversary celebration.;HGUC
HGUC Gundam GIANTS Ver.jpg;RX-78-2 Gundam GIANTS Ver.;Mobile Suit Gundam;N/A;2019 May;Yomiuri Giants (Bunkyo, Tokyo) exclusive color variant of HGUC-191,  bundled with specific match tickets. Limited to 3000 units. Released as part of the Gundam 40th anniversary celebration.;HGUC
HGUC Zaku II Lions Ver.jpg;MS-06S Zaku II Lions Ver.;Mobile Suit Gundam;N/A;2019 May;Saitama Seibu Lions exclusive color variant of HGUC-032,  bundled with specific match tickets. Limited to 3000 units. Released as part of the Gundam 40th anniversary celebration.;HGUC
HGUC Gundam HAWKS Ver.jpg;RX-78-2 Gundam HAWKS Ver.;Mobile Suit Gundam;N/A;2019 May;Fukuoka SoftBank Hawks exclusive color variant of HGUC-191,  bundled with specific match tickets. Limited to 3000 units. Released as part of the Gundam 40th anniversary celebration.;HGUC
HGUC Zaku II FIGHTERS Ver.jpg;MS-06S Zaku II FIGHTERS Ver.;Mobile Suit Gundam;N/A;2019 June;Hokkaido Nippon-Ham Fighters exclusive color variant of HGUC-032,  bundled with specific match tickets. Limited to 3000 units. Released as part of the Gundam 40th anniversary celebration.;HGUC
HGUC Gouf Dragons Ver.jpg;MS-07B Gouf Dragons Ver.;Mobile Suit Gundam;¥3,000;2019 May;Chunichi Dragons (Nagoya) exclusive color variant of HGUC-196,  bundled with specific match tickets. Released as part of the Gundam 40th anniversary celebration.;HGUC
HGUC Guncannon -Takuya Kai Model-.jpg;RX-77-2 Guncannon Takuya Kai Model;Mobile Suit Gundam;N/A;2019 May;Fukuoka SoftBank Hawks exclusive color variant of HGUC-190,  bundled with specific match tickets. Released as part of the Gundam 40th anniversary celebration.;HGUC
hguc_172.jpg;AMX-009 Dreissen;Mobile Suit Gundam ZZ;¥2,100;2014 February;"Color variant of HGUC-124,  chest and arm pieces remolded without the ""Sleeves"" grooves.";HGUC
HGUC Booster Expansion Set for Cruiser Mode (Combat Deployment Colors).jpg;Booster Expansion Set for Cruiser Mode (Combat Deployment Colors);Advance of Zeta: The Flag of Titans;¥1,500;2021 February;P-Bandai exclusive accessory kit for HGUC RX-121-3C Gundam TR-1 [Haze'n-thley-Rah II],  color variant of HGUC Cruiser Mode Use Booster Expansion Set. Includes additional RX-124 Gundam TR-6 [Woundwort] drum frame part.;HGUC
HGUC Gundam TR-1 -Haze'n-thley-.jpg;RX-121-3C Gundam TR-1 [Haze'n-thley];Advance of Zeta: The Flag of Titans;¥3,500;2020 June;P-Bandai exclusive parts and color variant of HGUC-057, with leg parts revised to improve articulation,  D plate runner molded in KPS instead of ABS.;HGUC
HGUC Gundam TR-1 -Hazel Custom- & Expansion Parts for RX-124 Gundam TR-6.jpg;RX-121-1 Gundam TR-1 [Hazel Custom] & Expansion Parts for RX-124 Gundam TR-6;Advance of Zeta: The Flag of Titans;¥1,500;2019 May;P-Bandai exclusive re-release of HGUC-056 bundled with accessory kit for HGUC RX-124 Gundam TR-6 [Woundwort],  D plate runner molded in KPS instead of ABS. Includes water slide decal sheet.;HGUC
HGUC Gundam TR-1 -Advanced Hazel- & Expansion Parts for Gundam TR-6.jpg;RX-121-2A Gundam TR-1 [Advanced Hazel] & Expansion Parts for RX-124 Gundam TR-6;Advance of Zeta: The Flag of Titans;¥1,700;2019 June;P-Bandai exclusive re-release of HGUC-057 bundled with accessory kit for HGUC RX-124 Gundam TR-6 [Woundwort],  D plate runner molded in KPS instead of ABS. Includes water slide decal sheet.;HGUC
20121228194232ab8.jpg;MSA-003 Nemo;Mobile Suit Zeta Gundam;¥1,500;2013 January;Color variant of HGUC-140,  GM Rifle replaced with Beam Rifle. Last HGUC kit to have pictures of actual model kits in the background of the boxart;HGUC
HGUC Zeta Gundam -U.C.0088-.jpg;MSZ-006 Zeta Gundam [U.C.0088];Mobile Suit Zeta Gundam;¥2,000;2018 September;P-Bandai exclusive parts variant of HGUC-203,  half of the parts from the original runners omitted and replaced with new F1, F2, and G plate runners.;HGUC
HGUC II Neo Zeong (Narrative Ver.).jpg;NZ-999 II Neo Zeong (Narrative Ver.);Mobile Suit Gundam Narrative;¥26,000;2019 February;P-Bandai exclusive parts and color variant of HGUC-181,  HGUC-116 replaced by HGUC-217. Includes water slide decal sheet.;HGUC
hguc184.jpg;GW-9800 Gundam Airmaster;After War Gundam X;¥1,700;2014 July;Transforms via head removal. First release had mold issue on piece E5,  later releases had this issue corrected.;HGUC
HGUC Zaku II EAGLES Ver.jpg;MS-06S Zaku II EAGLES Ver.;Mobile Suit Gundam;¥2,778;2019 April;Tohoku Rakuten Golden Eagles exclusive color variant of HGUC-032. Available during specific match days,  limited to 3000 units. Released as part of the Gundam 40th anniversary celebration.;HGUC
Hguc-msn0100-mbl.jpg;Hyaku-Shiki + “Mega Bazooka Launcher”;Mobile Suit Zeta Gundam;¥1,800;2004 July;Enhanced version of HGUC-005,  molded in golden yellow instead of original gold chrome plating. Mega Bazooka Launcher is fully transformable with minor parts swapping. Includes custom display base. Works with linkage part of HGUC-061.;HGUC
HGUC Rick Dias (Quattro Bajeena Custom).jpg;RMS-099 Rick Dias (Quattro Bajeena Custom);Mobile Suit Zeta Gundam;¥1,900;2020 August;P-Bandai exclusive parts and color variant of HGBD RMS-099BC Build G Gundam,  newly molded version of HGUC-033 with better articulation and improved proportions.;HGUC
HGUC Zaku II.jpg;MS-06 Zaku II;Mobile Suit Gundam;¥1,600;2021 December;Parts and color variant of HGUC-234,  newly molded version of HGUC-040 with better articulation and improved proportions.;HGUC
HGUC Zeong Meiji almond chocolate Ver.jpg;MSN-02 Zeong Meiji almond chocolate Ver.;Mobile Suit Gundam;N/A;2021 February;Meiji exclusive color variant of HGUC-022,  offered as a lottery prize in ALMOND x GUNDAM campaign. Limited to 2400 units.;HGUC
N/A;RX-93 ν Gundam Meiji almond chocolate Ver.;Mobile Suit Gundam: Char's Counterattack;N/A;2021 September;Meiji exclusive color variant of HGUC-086,  offered as a lottery prize in ALMOND x GUNDAM campaign. Limited to 2400 units.;HGUC
HGUC Zaku II EneKey Ver.jpg;MS-06S Char's Zaku II EneKey Ver.;Mobile Suit Gundam;N/A;2020 December;Enekey exclusive color variant of HGUC-032,  offered as a lottery prize in celebration of the 1st anniversary of EneKey. Limited to 4000 units.;HGUC
HGUC Gundam -UNIQLO Color-.jpg;RX-78-2 Gundam [UNIQLO Color];Mobile Suit Gundam;N/A;2019 March;UNIQLO Japan and China exclusive color variant of HGUC-021 without the hyper bazooka and FF-X7 Core Fighter,  offered as bonus for the purchase of Gundam 40th anniversary T-shirts. Includes UNIQLO marking sheet. Released as part of the Gundam 40th anniversary celebration.;HGUC
HGUC Zaku II -UNIQLO Color-.jpg;MS-06S Zaku II [UNIQLO Color];Mobile Suit Gundam;N/A;2019 March;UNIQLO Japan and China exclusive color variant of HGUC-032,  offered as bonus for the purchase of Gundam 40th anniversary T-shirts. Includes UNIQLO marking shet. Released as part of the Gundam 40th anniversary celebration.;HGUC
HGUC Gundam -UNIQLO-.jpg;RX-78-2U Gundam [UNIQLO];Mobile Suit Gundam;N/A;2020 April;UNIQLO exclusive color variant of HGUC-021,  offered as bonus for the purchase of UNIQLO x Gundam T-shirts. Includes UNIQLO marking sheet. Released as part of the Gunpla 40th anniversary celebration.;HGUC
HGUC Zaku II -UNIQLO-.jpg;MS-06SU Zaku II [UNIQLO];Mobile Suit Gundam;N/A;2020 April;UNIQLO exclusive color variant of HGUC-032,  offered as bonus for the purchase of UNIQLO x Gundam T-shirts. Includes UNIQLO marking sheet. Released as part of the Gunpla 40th anniversary celebration.;HGUC
HG Unicorn Banshee Destroy Mode Boxart.jpg;RX-0[N] Unicorn Gundam 02 Banshee Norn (Destroy Mode);Mobile Suit Gundam Unicorn;¥1,450;2014 March;Parts variant of HGUC-134,  psychoframe molded in clear orange instead of gold.  Uses the F plate runner of HGUC RX-0 Unicorn Gundam 03 Phenex (Destroy Mode) Ver.GFT.;HGUC
HGCE Infinite Justice Gundam.jpg;ZGMF-X19A 8 Justice Gundam;Mobile Suit Gundam SEED Destiny;¥2,200;2020 May; Parts and color variant of HGBD:R-004,  remake of HGSEED-32 with better articulation and improved proportions.;HGUC
HGUC-Gouf-Revive.jpg;MS-07B Gouf (Revive Ver.);Mobile Suit Gundam;¥1,500;2016 April;Parts variant of HGBF-015,  remake of HGUC-009 with better articulation and improved proportions. The left hand's 75mm machine gun can be swapped with a normal hand. Backpack is compatible with HGBF-015's Customized Backpack.;HGUC
HGUC Gundam Mk-II Titan.jpg;RX-178 Gundam Mk-II [Titans] (Revive Ver.);Mobile Suit Zeta Gundam;¥1,500;2015 November;Color variant of HGUC-193,  remake of HGUC-030 with better articulation and improved proportions. Includes marking sheet for units 01-03.;HGUC
HGUC-BlueDestinyUnit2EXAM.jpg;"RX-79BD-2 Blue Destiny Unit 2 ""EXAM""";Mobile Suit Gundam Side Story: The Blue Destiny;¥1,600;2017 December;Parts and color variant of HGUC-207,  remake of HGUC-077 with better articulation and improved proportions. Transforms to EXAM Mode with parts-swapping on head and backpack. Includes shoulder armor parts to build either the standard or Nimbus Schterzen version.;HGUC
HGUC Blue Destiny Unit 3 EXAM.jpg;"RX-79BD-3 Blue Destiny Unit 3 ""EXAM""";Mobile Suit Gundam Side Story: The Blue Destiny;¥1,600;2018 March;Parts and color variant of HGUC-207,  remake of HGUC-082 with better articulation and improved proportions.;HGUC
hguc_171.jpg;GAT-X105+AQM/E-X01 Aile Strike Gundam;Mobile Suit Gundam SEED;¥1,400;2014 February;Parts variant of HGBF-001,  remake of HGSEED-01 with better articulation and improved proportions. First kit to be released from the Cosmic Era timeline (HGCE). Compatible with Striker Packs from the HGSEED and No-Grade 1/144 kits.;HGUC
Hguc-ms-06s.jpg;MS-06S “Zaku II Commander Type” (Char Aznable custom);Mobile Suit Gundam;¥1,000;2002 July;First 1/144 scale Zaku II kit to feature a movable monoeye,  removal of helmet required to adjust monoeye.;HGUC
HGCE Force Impulse Gundam-Revive.jpg;ZGMF-X56S/a Force Impulse Gundam (Revive Ver.);Mobile Suit Gundam SEED Destiny;¥1,800;2016 June;Newly molded version of HGSEED-17 with better articulation and improved proportions. Can be separated into Chest Flyer and Leg Flyer,  shield transforms via parts-swapping. Includes Silhouette Flyer and non-transformable YFX-M56S Core Splendor in fighter mode and docking mode, as well as two Action Base adapters for Chest Flyer and Leg Flyer.;HGUC
HGUC RX-121-1 Gundam TR-1 Hazel.jpg;RX-121-1 Gundam TR-1 [Hazel Custom];Advance of Zeta: The Flag of Titans;¥1,300;2005 September;First ever mobile suit to use double-jointed elbow parts previously used in Master Grade kits,  this became one of the basic gimmicks of later HGUC models. First release included ''Advance of Zeta Guide Book''. Later reissues had the D plate runner molded in KPS instead of ABS.;HGUC
AMS-119 Geara Doga.jpg;AMS-119 Geara Doga;Mobile Suit Gundam: Char's Counterattack;¥1,800;2008 November;First HG kit to use a switch under the head to rotate the monoeye,  this would later on become a standard feature in 1/144 scale Geara Zulu and most Zaku II kits. Features gunmetal colored joint and weapon parts. Includes optional commander type head.;HGUC
Hguc-rx-78-2.jpg;RX-78-2 “Gundam”;Mobile Suit Gundam;¥1,000;2001 May;The first HGUC Gundam to use clear colored beam saber effect parts,  this would not be standard on HGUC Gundams until 2005. Includes non-transformable FF-X7 Core Fighter.;HGUC
Gunpla_HGUC_GMSniperII-WD_box.jpg;RGM-79SP GM Sniper II (White Dingo Team Custom);Mobile Suit Gundam Side Story 0079: Rise From The Ashes;¥1,800;2012 September;P-Bandai exclusive color variant of HGUC-146 with new head parts,  uses the D plate runner of HGUC-077 and the F plate runner of HGHG-02. Includes Long Range Beam Rifle, Medium Shield, Vulcan Pod, 100 mm machine gun, M353A4 Bloodhound, two Federation soldier figurines, and extra marking sheet. Released under the sub-line High Grade U.C. Hard Graph.;HGUC
hguc181.jpg;NZ-999 Neo Zeong;Mobile Suit Gundam Unicorn;¥27,000;2014 June;Enhanced version of HGUC-116. Includes Rocket Bazooka, custom display base, and storage box. At a height of 86&nbspcm, it is one of the tallest HGUC kits ever made., ;HGUC
Hguc-ms-07b3.jpg;MS-07B-3 Gouf Custom;Mobile Suit Gundam: The 08th MS Team;¥1,600;2010 November;Uses the D1 plate runner of the original HG kit. ;HGUC
Hguc-rx77.jpg;"RX-77-2 ""Guncannon""";Mobile Suit Gundam;¥800;1999 May;The first HGUC kit ever released. Includes Spray Missiles., ;HGUC
Hguc-yms15.jpg;"YMS-15 ""Gyan""";Mobile Suit Gundam;¥800;1999 July;First 1/144 scale kit to use a detachable clear colored beam effect part for its beam saber., ;HGUC
Zaku III custom.jpg;"AMX-011S ""Zaku III Custom""";Mobile Suit Gundam ZZ;¥1,500;1999 August;N/A;HGUC
AMX-004 Qubeley HG.jpg;"AMX-004 ""Qubeley""";Mobile Suit Zeta Gundam;¥1,500;1999 September;N/A;HGUC
MSN-00100 Hyaku Shiki HG.jpg;"MSN-00100 ""Hyaku-Shiki""";Mobile Suit Zeta Gundam;¥1,500;1999 October;"First HGUC kit to use chrome plated parts. Parts runners use ""undergating"" arrangement, visually reducing the amount of nub marks during assembly. Includes dry transfer sheet with two ""百"" markings. ";HGUC
Hguc-msm-07.jpg;"MSM-07 ""Z'Gok""";Mobile Suit Gundam;¥700;1999 November;N/A;HGUC
Hguc-rx75-4.jpg;"RX-75 ""Guntank""";Mobile Suit Gundam;¥800;2000 January;First HGUC kit to not include stickers , ;HGUC
Hguc-msm-03.jpg;"MSM-03 ""Gogg""";Mobile Suit Gundam;¥800;2000 March;N/A;HGUC
Hguc-ms-07b.jpg;"MS-07B ""Gouf""";Mobile Suit Gundam;¥800;2000 April;N/A;HGUC
Hguc-rms-099.jpg;"RMS-099 ""Rick Dias""";Mobile Suit Zeta Gundam;¥1,200;2000 June;N/A;HGUC
Hguc-amx-004ii.jpg;"AMX-004-2 ""Qubeley Mk-II""";Mobile Suit Gundam ZZ;¥1,500;2000 June;Color variant of HGUC-004., ;HGUC
10011964.jpg;"RMS-106 ""Hi-Zack""";Mobile Suit Zeta Gundam;¥1,000;2000 July;"Later reissues of this kit have the pelvis piece B7 molded with a rectangular hole to accommodate an Action Base 2. Compatible with the ""Weapons for Mobile Suit"" kit of the 1985 ''Zeta Gundam'' Gunpla series. ";HGUC
Hguc-rx78gp01.jpg;"RX-78GP01 ""Gundam GP01""";Mobile Suit Gundam 0083: Stardust Memory;¥1,200;2000 August;First Gundam released in the HGUC line. Includes non-transformable FF-XII Core Fighter II and 90mm Machine Gun as seen in episodes Endless Pursuit and Into Battle, Albion! of the OVA. ;HGUC
Zaku III.jpg;"AMX-011 ""Zaku III""";Mobile Suit Gundam ZZ;¥1,500;2000 September;Parts and color variant of HGUC-003., ;HGUC
015.jpg;"AMX-107 ""Bawoo""";Mobile Suit Gundam ZZ;¥1,200;2000 September;First transformable/separable mobile suit in the HGUC line., ;HGUC
Gelgoog Marine.jpg;"MS-14F ""Gelgoog Marine""";Mobile Suit Gundam 0083: Stardust Memory;¥1,200;2000 October;N/A;HGUC
Dom tropen.jpg;"MS-09F ""Dom Tropen""";Mobile Suit Gundam 0083: Stardust Memory;¥1,500;2000 November;N/A;HGUC
Gundam GP01Fb.jpg;"RX-78GP01Fb ""Gundam GP01Fb""";Mobile Suit Gundam 0083: Stardust Memory;¥1,500;2000 December;Parts variant of HGUC-013. Includes non-transformable FF-XII-Fb Core Fighter II Full Burnern., ;HGUC
Z'Gok Char.jpg;"MSM-07S ""Z'Gok Commander Type"" (Char Aznable custom)";Mobile Suit Gundam;¥700;2001 February;Color variant of HGUC-006., ;HGUC
GM.jpeg;RGM-79 “GM”;Mobile Suit Gundam;¥700;2001 April;N/A;HGUC
Zeong.jpg;MSN-02 “Zeong”;Mobile Suit Gundam;¥1,800;2001 June;First HGUC model to include a display base. Fingers are compatible with MG beam saber effect parts., ;HGUC
Hguc-s-gundam.jpg;MSA-0011 “S Gundam”;Gundam Sentinel;¥1,800;2001 August;Not transformable unlike its MG counterpart. Includes non-transformable FXA-08GB G-Core. G-Attacker unit sold separately as EX-05. ;HGUC
024.jpg;RMS-141 “Xekueins”;Gundam Sentinel;¥1,600;2001 October;N/A;HGUC
RX-78GP03S Gundam G0P3S.jpg;RX-78GP03S “Gundam GP03S”;Mobile Suit Gundam 0083: Stardust Memory;¥1,600;2001 December;Features deployable folding arms. Includes non-transformable FF-XII-Sp Core Fighter II-Sp. ;HGUC
026.jpg;MS-14Fs “Gelgoog Marine” (Cima Garahau custom);Mobile Suit Gundam 0083: Stardust Memory;¥1,500;2002 January;Parts and color variant of HGUC-016., ;HGUC
027.jpg;MS-09F “Dom Tropen” (Kimberlite Forces colors);Mobile Suit Gundam 0083: Stardust Memory;¥1,600;2002 February;Parts and color variant of HGUC-017. Includes open left hand, rear skirt thruster, and additional weapons and ammo., ;HGUC
Hguc-orchis.jpg;RX-78GP03 “Gundam GP03 ‘Dendrobium’”;Mobile Suit Gundam 0083: Stardust Memory;¥28,000;2002 March;Enhanced version of HGUC-025. It is the longest at “about 1m*0.5m*0.6m” and most expensive non-bundled HGUC kit., ;HGUC
Hguc-ex-s.jpg;MSA-0011[Ext] “Ex-S Gundam”;Gundam Sentinel;¥2,500;2002 April;Parts variant of HGUC-023. Not transformable unlike its MG counterpart. ;HGUC
Hguc-rx-178t.jpg;"RX-178 “Gundam Mk-II"" (Titans colors)";Mobile Suit Zeta Gundam;¥1,000;2002 May;First kit to have a right hand and beam saber molded as a single piece. Includes marking sheet for units 01-03. Later reissues of this kit have HGUC-053's modified foot parts., ;HGUC
Hguc-amx-107-mp.jpg;"AMX-107 “Bawoo"" (Mass Production colors)";Mobile Suit Gundam ZZ;¥1,200;2002 June;Color variant of HGUC-015. Fully transformable kit., ;HGUC
Hguc-rms-099-2.jpg;RMS-099 “Rick Dias” (Quattro Bajeena custom);Mobile Suit Zeta Gundam;¥1,200;2002 August;Color variant of HGUC-010., ;HGUC
Hguc-ms-06fs.jpg;MS-06Fs “Zaku II Type FS” (Garma Zabi custom);Mobile Suit Variations;¥1,000;2002 September;Color variant of HGUC-032. Includes Magella Top Cannon, larger Heat Hawk, and a different head piece with vulcan guns. First HGUC mobile suit in MSV line. ;HGUC
Hguc-super-gundam.jpg;FXA-05D/RX-178 “Super Gundam”;Mobile Suit Zeta Gundam;¥2,000;2002 November;Color variant of HGUC-030 with fully transformable FXA-05D G-Defenser. Also the first HGUC kit to introduce Mobile Armors with similar size to the Mobile Suits. Later reissues of this kit have HGUC-053's modified foot parts., ;HGUC
Hguc-pmx-003.jpg;PMX-003 The-O;Mobile Suit Zeta Gundam;¥2,400;2002 December;N/A, ;HGUC
HGUC-MSM03C 101.jpg;MSM-03C “Hygogg”;Mobile Suit Gundam 0080: War in the Pocket;¥1,200;2003 June;N/A;HGUC
Hguc-rgm-79d.jpg;RGM-79D “GM Cold Districts Type”;Mobile Suit Gundam 0080: War in the Pocket;¥800;2003 July;Last HGUC kit to have a non-functional beam saber handle., ;HGUC
MSM-07E Z'Gok Experiment - Boxart0.jpg;MSM-07E “Z'Gok Experiment”;Mobile Suit Gundam 0080: War in the Pocket;¥1,200;2003 August;N/A;HGUC
Zaku 2.png;MS-06F “Zaku II”;Mobile Suit Gundam;¥1,000;2003 September;Color variant of HGUC-032. Includes two leg-mounted missile pods., ;HGUC
Hguc-msz-006.jpg;MSZ-006 “Zeta Gundam”;Mobile Suit Zeta Gundam;¥1,600;2003 October;First HGUC kit to transform via parts-swapping. Includes grenade launchers and Hyper Mega Launcher with landing gear. Also the last HGUC kit to have a right hand and beam saber molded as a single piece., ;HGUC
Hguc-orx-005.jpg;ORX-005 “Gaplant”;Mobile Suit Zeta Gundam;¥2,200;2003 November;Fully transformable kit. Includes booster unit and display base., ;HGUC
Hguc-ms-09rii-sp.jpg;MS-09R2 “Rick Dom II”;Mobile Suit Gundam 0080: War in the Pocket;¥1,500;2004 January;N/A;HGUC
Hguc-rx-77d.jpg;RX-77D “Guncannon Mass Production Type”;Mobile Suit Gundam 0080: War in the Pocket;¥1,000;2004 February;N/A;HGUC
Gelgoog-J HGUC 1-144 01.jpg;MS-14Jg “Gelgoog Jäger”;Mobile Suit Gundam 0080: War in the Pocket;¥1,200;2004 April;Released to coincide with the 15th anniversary of ''Mobile Suit Gundam 0080''., ;HGUC
Hguc-rgm-79s.jpg;RGM-79G “GM Command”;Mobile Suit Gundam 0080: War in the Pocket;¥800;2004 May;Uses a modified version of the A plate runner of HGUC-038., ;HGUC
Hguc-rx-78nt-1.jpg;RX-78NT-1 “Gundam NT1”;Mobile Suit Gundam 0080: War in the Pocket;¥1,500;2004 May;Includes removable Chobham Armor parts. The last HGUC Gundam kit to have a single-piece beam saber., ;HGUC
HGUC - MRX-009 Psycho Gundam - Boxart.jpg;MRX-009 “Psycho Gundam”;Mobile Suit Zeta Gundam;¥5,000;2004 August;Fully transformable kit. Largest stand-alone HGUC kit to date., ;HGUC
Hguc-g-armor.jpg;“G-Armor” (RX-78-2 “Gundam” + “G-Fighter”);Mobile Suit Gundam;¥2,800;2004 October;Enhanced verson of HGUC-021. The Gundam's feet are modified to allow docking with the G-Fighter. Backpack has also been modified to hold the beam sabers more firmly. Includes display base., ;HGUC
Hguc-rgm78gs.jpg;RGM-79G “GM Command Space”;Mobile Suit Gundam 0080: War in the Pocket;¥800;2004 October;Parts and color variant of HGUC-046., ;HGUC
Marasai.jpg;RMS-108 “Marasai”;Mobile Suit Zeta Gundam;¥1,400;2005 January;First kit to include a peg in the right weapon hand for extra security., ;HGUC
Hguc-gundam-mk-ii-fa.jpg;RX-178 Gundam Mk-II + Flyingarmor;Mobile Suit Zeta Gundam;¥2,000;2005 January;Color variant of HGUC-030 with Flying Armor. The Gundam Mk-II's legs are modified like HGUC-50, allowing for greater movement. Includes display base for Flying Armor and mesh pipes for the beam saber holder joints on the backpack. Also the first kit to include a preview of all the previously released kits from that anime series in the instruction manual. , ;HGUC
054.jpg;NRX-044 Asshimar;Mobile Suit Zeta Gundam;¥2,000;2005 June;"Fully transformable kit. Includes ""swivel"" display base with storage compartment for extra parts and adapter for Mobile Armor mode., ";HGUC
Hizack boxart.jpg;RMS-106 Hi-Zack (Earth Federation Force colors);Mobile Suit Zeta Gundam;¥1,000;2005 June;Color variant of HGUC-012. Includes marking sheet with EFF and Titans symbols. Later reissues of this kit have the pelvis piece B7 molded with a rectangular hole to accommodate an Action Base 2., ;HGUC
HGUC RX-121-2A Gundam TR-1 Advanced Hazel.jpg;RX-121-2A Gundam TR-1 [Advanced Hazel];Advance of Zeta: The Flag of Titans;¥1,600;2005 November;Parts and color variant of HGUC-056. Later reissues had the D plate runner molded in KPS instead of ABS., ;HGUC
G0139596.jpg.png;RX-110 Gabthley;Mobile Suit Zeta Gundam;¥1,600;2005 December;"Fully transformable kit with three modes, including a ""Middle Form"". Includes ""swivel"" display base with storage compartment for extra parts and adapter for Mobile Armor mode., ";HGUC
Hguc-ms-09r.jpg;MS-09/MS-09R Dom/Rick Dom;Mobile Suit Gundam;¥1,700;2006 January;First ever HGUC model to provide spare parts of alternate types. First 1/144 Dom to use a clear visor and adjustable monoeye., ;HGUC
060.jpg;PMX-001 Palace Athene;Mobile Suit Zeta Gundam;¥1,800;2006 February;N/A;HGUC
Hguc-msa-005.jpg;MSA-005 Methuss;Mobile Suit Zeta Gundam;¥1,400;2006 March;Fully transformable kit. Linkage part to HGUC-048 is included., ;HGUC
Hguc-amx-003gazac.jpg;AMX-003 Gaza-C (Haman Karn Custom);Mobile Suit Zeta Gundam -A New Translation-;¥1,400;2006 April;Fully transformable kit. Actual kit colors are not accurate to the anime art, as the parts are molded in pinkish white and maroon instead of the proper lavender and purple., ;HGUC
Hguc-amx-003gazac-2.jpg;AMX-003 Gaza-C;Mobile Suit Zeta Gundam;¥1,400;2006 April;Color variant of HGUC-062. Fully transformable kit. Includes BA-1 display base., ;HGUC
Hguc-ms-05b.jpg;MS-05B Zaku I;Mobile Suit Gundam;¥1,000;2006 May;N/A;HGUC
Hguc-ems10.jpg;EMS-10 Zudah;Mobile Suit Gundam MS IGLOO;¥1,400;2006 June;Features extendable arms. Includes pieces to make three different head configurations (two standard type and one commander type)., ;HGUC
HGUC RX-78-2GP02A Gundam Physalis Boxart.jpg;RX-78GP02A Gundam GP02A;Mobile Suit Gundam 0083: Stardust Memory;¥2,000;2006 July;Released to commemorate the 15th anniversary of ''Mobile Suit Gundam 0083''. Uses almost no polycaps on the vital joints (only on the waist, hips, ankles, and accessories). Includes BA-1 display base and adapter for use with HGUC-013 or HGUC-018 to re-enact fight scenes from the OVA., ;HGUC
Powered-gm-hguc.jpg;RGM-79 Powered GM;Mobile Suit Gundam 0083: Stardust Memory;¥1,200;2006 August;N/A;HGUC
Hguc-ms-05b-bt.jpg;MS-05B Zaku I (Black Tri-Stars Type);Mobile Suit Variations;¥1,000;2006 August;Color variant of HGUC-064., ;HGUC
Gundam TR-1 Hazel II.jpg;RX-121-2 Gundam TR-1 [Hazel II];Advance of Zeta: The Flag of Titans;¥1,500;2006 September;Parts variant of HGUC-057., ;HGUC
Hguc-ms-14s.jpg;MS-14S Gelgoog (Char Aznable Custom);Mobile Suit Gundam;¥1,500;2006 October;First HGUC kit to incorporate a separate pelvis joint that allows forward and backward hip movement. This feature would later on be used in the HGUC and other HG lines., ;HGUC
Hguc-ms-05l.jpg;MS-05L Zaku I Sniper Type;Harmony of Gundam;¥1,400;2006 November;Parts and color variant of HGUC-064., ;HGUC
